user_input,retrieved_contexts,reference_contexts,response,reference,synthesizer_name,tools_used,num_contexts
How do the examples in Appendix A and Appendix B illustrate the differences in disbursement timing and eligibility requirements for students in clock-hour or non-term credit-hour programs versus subscription-based programs?,[],"['<1-hop>\n\nboth the credit or clock hours and the weeks of instructional time in a payment period before receiving a disbursement of Pell Grant, FSEOG, TEACH Grant or Direct Loan funds for the next payment period. For the Direct Loan Program only, this same requirement applies to students who are enrolled in programs with nonstandard terms that are not substantially equal in length. Effect of Accelerated Progression on Disbursement Timing in a Clock-Hour or Non-Term Credit-Hour Program The Pell Grant or TEACH Grant amount that a student is eligible to receive for a payment period in a clock-hour or non- term credit-hour program is based on the number of hours and weeks in the scheduled payment periods for the program that are established at the beginning of the program based on the program length (as described earlier in this chapter). These scheduled payment periods do not change, regardless of a student9s rate of progression through a clock-hour or non-term credit-hour program. This means that if a student completes additional weeks of instructional time or hours while completing the other measure of a payment period, the actual number of weeks or hours that the student completes before a disbursement can be made for the next payment period may differ from the number of weeks or hours in the scheduled payment period used to determine the student9s grant amount for the payment period. Although a student9s completion of additional weeks or hours in a payment period has no effect on the scheduled payment periods for purposes of determining Pell Grant and TEACH Grant payment amounts, an undergraduate student who accelerates in a clock-hour or non-term credit-hour program may have reduced Direct Loan eligibility in the final academic year of a program. Specifically, if a student enrolled in a program that is greater than one academic year in length completes additional clock or credit hours prior to the final academic year of the program, this may result in a final period of study that contains fewer clock or credit hours than the number of hours in the program9s defined academic year. In this circumstance, the Direct Loan annual loan limit for an undergraduate student must be prorated (reduced). The principles described above are illustrated by the examples in Appendix A at the end of this chapter. For guidance on calculating Pell Grant and TEACH Grant awards for clock-hour and non-term credit-hour programs, see Volume 7. For information on Direct Loan annual loan limit proration and annual loan limit progression in clock-hour and non-term credit- hour programs, see Volume 8, Chapters 5 and 6. If your school is unable to determine when a student has successfully completed half of the credit or clock hours in a program, academic year, or remainder of a program, the student is considered to have begun the second payment period of the program, academic year, or remainder of a program at the later of the date (identified by your school) that the student has successfully completed: half of the academic coursework in the program, academic year, or remainder of the program; or half of the number of weeks of instructional time in the program, academic year, or remainder of the program.', '<2-hop>\n\nDisbursement Timing in Subscription-Based Programs For the first two subscription periods (terms) that a student attends in a subscription-based program, there is no requirement for the student to have completed a certain amount of coursework before receiving a disbursement of Title IV funds (the same as in any other term-based program using credit hours). However, to receive a disbursement of Title IV aid for each subsequent subscription period in the program, the student must have completed a cumulative number of credit hours equal to the total of the number of hours for which the student was enrolled in all previously attended subscription periods in the program, excluding the number of hours for which the student was enrolled in the most recently attended subscription period. For more detailed guidance on the disbursement rules for subscription-based programs, including examples, refer to Appendix B at the end of this chapter. Multiple Disbursements Within a Payment Period The regulations governing the Title IV programs generally permit schools to pay Title IV funds at such times and in such installments within each payment period as will best meet students9 needs. This gives schools the ability to apportion the payment if doing so will be in the best interest of the student. For example, if a payment period is particularly long, a school might choose to pay in multiple installments to the extent program requirements permit to ensure that a student will have funds to pay rent later in the payment period. If a school chooses to schedule multiple Direct Loan disbursements within a single payment period, the disbursements must be substantially equal. Note also that if the loan period for a Direct Loan is a single payment period, the loan must be disbursed in at least two installments unless the school qualifies for an exception to the multiple disbursement requirement. See Volume 8, Chapter 3 for more']","It appears there is a technical issue with retrieving the specific information from the document. Without access to the exact content of Appendix A and Appendix B, I cannot provide a detailed comparison. However, I can offer a general explanation based on typical differences between these types of programs:

1. Disbursement Timing:
   - Clock-hour or Non-term Credit-hour Programs: Disbursements are often tied to specific payment periods or milestones within the academic year, such as the start of each term or after completing certain hours.
   - Subscription-based Programs: Disbursements may occur on a more flexible or ongoing basis, aligned with the subscription schedule or continuous access periods.

2. Eligibility Requirements:
   - Clock-hour or Non-term Credit-hour Programs: Eligibility may depend on enrollment in a recognized program, maintaining satisfactory academic progress, and meeting specific credit-hour or clock-hour thresholds.
   - Subscription-based Programs: Eligibility might be based on subscription status, payment of fees, or ongoing engagement with the program, rather than traditional academic progress metrics.

If you need precise information from the appendices, I recommend consulting the original document directly or providing the text for analysis.","The examples in Appendix A illustrate the principles of disbursement timing and eligibility for Pell Grant, TEACH Grant, and Direct Loan funds in clock-hour or non-term credit-hour programs, including how accelerated progression can affect Direct Loan annual loan limit proration in the final academic year. In contrast, Appendix B provides detailed guidance and examples on the disbursement rules for subscription-based programs, specifically showing that while the first two subscription periods do not require completion of coursework before disbursement, subsequent periods require students to have completed a cumulative number of credit hours based on prior enrollment. Thus, Appendix A and Appendix B demonstrate the distinct requirements and timing for disbursements in these different program structures.",multi_hop_specific_query_synthesizer,['ask_parent_document_llm_tool'],0
"Wut are the disbursment timing rules for Title IV funds in subscription-based programs and how does Volume 8, Chapter 3 provide guidance for clinical work in standard terms?",[],"['<1-hop>\n\nDisbursement Timing in Subscription-Based Programs For the first two subscription periods (terms) that a student attends in a subscription-based program, there is no requirement for the student to have completed a certain amount of coursework before receiving a disbursement of Title IV funds (the same as in any other term-based program using credit hours). However, to receive a disbursement of Title IV aid for each subsequent subscription period in the program, the student must have completed a cumulative number of credit hours equal to the total of the number of hours for which the student was enrolled in all previously attended subscription periods in the program, excluding the number of hours for which the student was enrolled in the most recently attended subscription period. For more detailed guidance on the disbursement rules for subscription-based programs, including examples, refer to Appendix B at the end of this chapter. Multiple Disbursements Within a Payment Period The regulations governing the Title IV programs generally permit schools to pay Title IV funds at such times and in such installments within each payment period as will best meet students9 needs. This gives schools the ability to apportion the payment if doing so will be in the best interest of the student. For example, if a payment period is particularly long, a school might choose to pay in multiple installments to the extent program requirements permit to ensure that a student will have funds to pay rent later in the payment period. If a school chooses to schedule multiple Direct Loan disbursements within a single payment period, the disbursements must be substantially equal. Note also that if the loan period for a Direct Loan is a single payment period, the loan must be disbursed in at least two installments unless the school qualifies for an exception to the multiple disbursement requirement. See Volume 8, Chapter 3 for more', '<2-hop>\n\nInclusion of Clinical Work in a Standard Term Periods of medical and education program clinical work which is conducted outside the classroom may not be included in a standard term, unless all of the following apply: All students in the program must participate in the practicum or clinical experience, and they must be required to complete the practicum or clinical experience as a condition for applying for licensure or authorization to practice the occupation they intend to pursue; The school has little or no control over the length or starting and ending dates of the practicum or clinical experience. This may be due to constraints imposed by outside licensing bodies or the need to accommodate schedules of entities with which students are being placed (e.g., school districts or hospitals); and Credit hours associated with the practicum or clinical experience must be associated with the term in which most of the training occurs, even if the starting and ending dates do not exactly align with the term dates and/or overlap with another term. If the clinical work meets all the above criteria, terms which include such clinical work are not required to be considered nonstandard, nor are such programs required to be considered non-term, even if the clinical work overlaps another term. This flexibility is limited to required clinical periods associated with standard term programs in medicine (including, but not limited to, allopathic, osteopathic, nursing, veterinary, dentistry, pharmacy, and physical therapy), and student teaching required to obtain a state teaching certificate. See Volume 8, Chapter 3 for additional guidance on certain exceptions to the normal loan period and disbursement timing rules for Direct Loans when clinical work that meets the criteria described above is included in a standard term. Nonstandard Terms Generally, nonstandard terms are terms that are not semesters, trimesters, or quarters. For example, a 5-week term or a 23-week term would be considered a nonstandard term because no standard term can be fewer than nine weeks or greater than 21 weeks in length. Like standard terms, nonstandard terms may be equal in length or may be of different lengths. If a program is offered in a combination of standard terms and nonstandard terms, the program is considered to be offered in nonstandard terms. Also, like standard terms, nonstandard terms may not overlap within a program. Even if a school calls its terms semesters, trimesters, or quarters, they are considered to be nonstandard terms if they do not comply with the policy on standard term length, as described earlier. For instance, a 22-week semester or an 8-week quarter must be treated as a nonstandard term, because a semester cannot contain more than 21 weeks and a quarter must include a minimum of nine weeks. Semesters, trimesters, or quarters are also considered to be nonstandard terms if academic progress is not measured in the manner normally associated with the type of term. For example, if a program is offered in 15-week semesters but measures academic progress in quarter credit hours, the semesters would be considered nonstandard terms.']","It seems there is a technical issue with retrieving the documents. I will attempt to resolve this and get the information for you.
It appears there is a technical issue preventing me from retrieving the specific document information at the moment. However, I can provide general knowledge based on my training data:

Disbursement Timing Rules for Title IV Funds in Subscription-Based Programs:
- Title IV funds are typically disbursed according to the institution's scheduled disbursement periods.
- For subscription-based programs, disbursements may be aligned with the start of each subscription period or module.
- Institutions must ensure that disbursements do not exceed the amount owed and are made in accordance with federal regulations.
- Students usually receive funds within a certain timeframe after the institution certifies enrollment and submits the disbursement request.
- There are specific rules about the timing of initial and subsequent disbursements, including limits on the amount that can be disbursed at different times.

Guidance in Volume 8, Chapter 3 for Clinical Work in Standard Terms:
- Volume 8, Chapter 3 of the Federal Student Aid Handbook generally provides guidance on the administration of federal student aid programs.
- It includes policies and procedures for disbursing funds, maintaining compliance, and managing student eligibility.
- For clinical work, the chapter may outline standards for documentation, supervision, and the educational requirements necessary for clinical training programs.
- It emphasizes the importance of adhering to regulatory standards to ensure the proper use of federal funds and the integrity of clinical education.

If you need precise details from the official documents, I recommend consulting the latest version of the Federal Student Aid Handbook or the specific volume and chapter mentioned. Would you like me to assist you in finding official sources or related information?","For the first two subscription periods in a subscription-based program, students do not need to complete a certain amount of coursework before receiving Title IV disbursements. For later periods, students must have completed a cumulative number of credit hours equal to all previously attended periods, excluding the most recent one. Volume 8, Chapter 3 gives more guidance, including for clinical work in standard terms, where clinical periods can be included as standard terms if certain criteria are met, and it also covers exceptions to normal loan period and disbursement timing rules when such clinical work is involved.",multi_hop_specific_query_synthesizer,['ask_parent_document_llm_tool'],0
how volume 8 chapter 6 and volume 8 chapter 3 talk about nonstandard terms and direct loan rules for subscription-based and clinical work programs?,[],"['<1-hop>\n\nnon-term (includes clock-hour calendars), or subscription-based. In a standard term or nonstandard term academic calendar, a term is generally a period in which all classes are scheduled to begin and end within a set time frame, and academic progress is measured in credit hours. In a non-term academic calendar, classes do not begin and end within a set time frame, such as a term. Academic progress in a non-term program can be measured in either credit or clock hours. In some cases (as discussed below), a program with terms must be treated as a non-term program for Title IV purposes. A subscription-based academic calendar is used only by subscription-based programs. A subscription-based program is a term-based program in which the school charges a student for each term on a subscription basis with the expectation that the student will complete a specified number of credit hours (or the equivalent) during that term. However, classes in a subscription-based program are not required to begin or end within a specific timeframe in each term, as is the case in a term-based calendar that is not subscription-based. For more detail on subscription-based programs, see Volume 2, Chapter 2. A subscription-based academic calendar consists of ""subscription periods"" that are either standard terms or substantially equal nonstandard terms (for guidance on when terms are considered to be substantially equal in length, see <Payment periods for programs using standard terms or substantially equal nonstandard terms= later in this chapter). Substantially equal nonstandard terms may be of any length, but if they are not at least nine weeks in length, the program must use BBAY 3 for purposes of monitoring Direct Loan annual loan limit progression (see Volume 8, Chapter 6 for more information on BBAY 3). Nonstandard terms that are not substantially equal in length are not permissible in a subscription-based academic calendar. The term ""subscription period"" is synonymous with ""term"" and ""payment period"" (payment periods are covered later in this chapter). Except for the fact that classes are not required to start and end within a term, the rules and requirements for term-based programs that are not subscription-based also apply to subscription-based programs. These requirements include: minimum and maximum term length restrictions for standard terms (see the discussion in the next section of this chapter); requirements for determining full-time enrollment (see Volume 1, Chapter 1); use of a Scheduled Academic Year (SAY), BBAY 1, BBAY 2, or BBAY 3 for monitoring Direct Loan annual loan limit progression (see Volume 8, Chapter 6); and use of Pell Grant formulas 1, 2, or 3 to calculate Pell Grant awards (see Volume 7, Chapter 4). Whether an academic calendar is standard term, nonstandard term, non-term, or subscription-based has implications for how aid is awarded and disbursed under the Title IV programs. Standard Terms: Semesters, Trimesters, and Quarters Semesters and trimesters contain between 14 and 21 weeks of instructional time. However, a summer term in a program using semesters or trimesters may contain fewer than 14 weeks. An academic calendar that uses semesters or trimesters traditionally has three terms, one each in the fall, spring, and summer, two of which comprise an academic year. For example, in a program using an SAY calendar, fall and spring would comprise an academic year. In a program using a', '<2-hop>\n\nInclusion of Clinical Work in a Standard Term Periods of medical and education program clinical work which is conducted outside the classroom may not be included in a standard term, unless all of the following apply: All students in the program must participate in the practicum or clinical experience, and they must be required to complete the practicum or clinical experience as a condition for applying for licensure or authorization to practice the occupation they intend to pursue; The school has little or no control over the length or starting and ending dates of the practicum or clinical experience. This may be due to constraints imposed by outside licensing bodies or the need to accommodate schedules of entities with which students are being placed (e.g., school districts or hospitals); and Credit hours associated with the practicum or clinical experience must be associated with the term in which most of the training occurs, even if the starting and ending dates do not exactly align with the term dates and/or overlap with another term. If the clinical work meets all the above criteria, terms which include such clinical work are not required to be considered nonstandard, nor are such programs required to be considered non-term, even if the clinical work overlaps another term. This flexibility is limited to required clinical periods associated with standard term programs in medicine (including, but not limited to, allopathic, osteopathic, nursing, veterinary, dentistry, pharmacy, and physical therapy), and student teaching required to obtain a state teaching certificate. See Volume 8, Chapter 3 for additional guidance on certain exceptions to the normal loan period and disbursement timing rules for Direct Loans when clinical work that meets the criteria described above is included in a standard term. Nonstandard Terms Generally, nonstandard terms are terms that are not semesters, trimesters, or quarters. For example, a 5-week term or a 23-week term would be considered a nonstandard term because no standard term can be fewer than nine weeks or greater than 21 weeks in length. Like standard terms, nonstandard terms may be equal in length or may be of different lengths. If a program is offered in a combination of standard terms and nonstandard terms, the program is considered to be offered in nonstandard terms. Also, like standard terms, nonstandard terms may not overlap within a program. Even if a school calls its terms semesters, trimesters, or quarters, they are considered to be nonstandard terms if they do not comply with the policy on standard term length, as described earlier. For instance, a 22-week semester or an 8-week quarter must be treated as a nonstandard term, because a semester cannot contain more than 21 weeks and a quarter must include a minimum of nine weeks. Semesters, trimesters, or quarters are also considered to be nonstandard terms if academic progress is not measured in the manner normally associated with the type of term. For example, if a program is offered in 15-week semesters but measures academic progress in quarter credit hours, the semesters would be considered nonstandard terms.']",It appears there is a technical issue preventing me from retrieving the specific information from the document. I will need to address this issue before I can provide the details you're requesting. Would you like me to try again later or assist you with something else?,"volume 8 chapter 6 is mentioned as giving more information on BBAY 3, which is used for monitoring Direct Loan annual loan limit progression in subscription-based programs with nonstandard terms that are not at least nine weeks in length. volume 8 chapter 3 is referenced for additional guidance on exceptions to normal loan period and disbursement timing rules for Direct Loans when clinical work that meets certain criteria is included in a standard term. both chapters provide details on how nonstandard terms affect Direct Loan rules, with chapter 6 focusing on subscription-based programs and BBAY 3, and chapter 3 addressing exceptions for clinical work in standard term programs.",multi_hop_specific_query_synthesizer,['ask_parent_document_llm_tool'],0
