user_input,retrieved_contexts,reference_contexts,response,reference,synthesizer_name,tools_used,num_contexts
"How does the disbursement timing for federal student aid differ between clock-hour or non-term credit-hour programs and subscription-based programs, particularly regarding the requirements students must meet before receiving subsequent disbursements?","['StudentAid.gov Search Results for: disbursement timing federal student aid', ""Summary: Federal student aid disbursement timing varies by loan type and school. Direct loans are typically disbursed in two payments. Contact your school's financial aid office for specific details."", 'Official Federal Information:\n1. How do I check the status of my FAFSA® form?\n   Note: If you submitted a paper FAFSA form, you can check the status of your form once we process it (roughly 7–10 days from the date mailed).', 'To check the disbursement status of your federal student ...\n   URL: https://studentaid.gov/help/check-fafsa-status', '2. Student Loan Repayment\n   Published Time: Fri, 21 Mar 2025 10:13:02 GMT', 'StudentAid.gov Search Results for: disbursement timing for clock-hour or non-term credit-hour programs', ""Summary: For clock-hour or non-term credit-hour programs, disbursements follow a non-term academic calendar, with payments made when students complete half the credit hours and instructional weeks. The first payment period is when students complete half the academic year's credit hours and weeks. The second payment period follows the same criteria for the second full academic year."", 'Official Federal Information:\n1. Final Program\n   prorate Direct Subsidized/Unsubsidized Loan limits under certain circumstances is different than the requirements for calculating Pell Grants. All clock-hour programs, non-term credit-hour programs, a...\n   URL: https://studentaid.gov/sites/default/files/fsawg/datacenter/library/FPRD/Saint-Josephs-College-ME00205109032020FPRDRedacted.pdf', ""2. Fed era I Student !~iid\n   pre>grains; however, based on the published information and pllblisbed policies, and during interviewswit)l the school's staff, the pre>gram structure varies from nonstandard to non-term programs. -Th...\n   URL: https://studentaid.gov/sites/default/files/fsawg/datacenter/library/FPRD/Five_Branches_University_031313_11302018_FPRD_Redacted.pdf"", '3. Eligibility Requirements | Federal Student Aid\n   passing an approved ability-to-benefit test (if you don’t have a diploma or state-recognized equivalent, a college can administer a test to determine whether you can benefit from the education offered...\n   URL: https://studentaid.gov/understand-aid/eligibility/requirements', 'StudentAid.gov Search Results for: disbursement timing for subscription-based programs', 'Summary: Disbursement timing for subscription-based programs via StudentAid.gov is not specified. Federal loan servicers update StudentAid.gov weekly. Loan information typically appears in 7-10 business days post-transfer.', 'Official Federal Information:\n1. ANNUAL REPORT FY 2020\n   The Next Gen FSA initiative delivered intuitive, self-service tools for students, parents, and borrowers. The new StudentAid.gov—FSA’s primary website for customers—consolidated the four most-visited ...\n   URL: https://studentaid.gov/sites/default/files/fy2020-fsa-annual-report.pdf', ""2. So Your Loan Was Transferred—What's Next?\n   Image 2\nHow long will it take for my new servicer’s info to show up on StudentAid.gov?\n----------------------------------------------------------------------------------"", 'Our federal loan servicers re...\n   URL: https://studentaid.gov/articles/your-loan-was-transferred-whats-next/']","['<1-hop>\n\nboth the credit or clock hours and the weeks of instructional time in a payment period before receiving a disbursement of Pell Grant, FSEOG, TEACH Grant or Direct Loan funds for the next payment period. For the Direct Loan Program only, this same requirement applies to students who are enrolled in programs with nonstandard terms that are not substantially equal in length. Effect of Accelerated Progression on Disbursement Timing in a Clock-Hour or Non-Term Credit-Hour Program The Pell Grant or TEACH Grant amount that a student is eligible to receive for a payment period in a clock-hour or non- term credit-hour program is based on the number of hours and weeks in the scheduled payment periods for the program that are established at the beginning of the program based on the program length (as described earlier in this chapter). These scheduled payment periods do not change, regardless of a student9s rate of progression through a clock-hour or non-term credit-hour program. This means that if a student completes additional weeks of instructional time or hours while completing the other measure of a payment period, the actual number of weeks or hours that the student completes before a disbursement can be made for the next payment period may differ from the number of weeks or hours in the scheduled payment period used to determine the student9s grant amount for the payment period. Although a student9s completion of additional weeks or hours in a payment period has no effect on the scheduled payment periods for purposes of determining Pell Grant and TEACH Grant payment amounts, an undergraduate student who accelerates in a clock-hour or non-term credit-hour program may have reduced Direct Loan eligibility in the final academic year of a program. Specifically, if a student enrolled in a program that is greater than one academic year in length completes additional clock or credit hours prior to the final academic year of the program, this may result in a final period of study that contains fewer clock or credit hours than the number of hours in the program9s defined academic year. In this circumstance, the Direct Loan annual loan limit for an undergraduate student must be prorated (reduced). The principles described above are illustrated by the examples in Appendix A at the end of this chapter. For guidance on calculating Pell Grant and TEACH Grant awards for clock-hour and non-term credit-hour programs, see Volume 7. For information on Direct Loan annual loan limit proration and annual loan limit progression in clock-hour and non-term credit- hour programs, see Volume 8, Chapters 5 and 6. If your school is unable to determine when a student has successfully completed half of the credit or clock hours in a program, academic year, or remainder of a program, the student is considered to have begun the second payment period of the program, academic year, or remainder of a program at the later of the date (identified by your school) that the student has successfully completed: half of the academic coursework in the program, academic year, or remainder of the program; or half of the number of weeks of instructional time in the program, academic year, or remainder of the program.', '<2-hop>\n\nDisbursement Timing in Subscription-Based Programs For the first two subscription periods (terms) that a student attends in a subscription-based program, there is no requirement for the student to have completed a certain amount of coursework before receiving a disbursement of Title IV funds (the same as in any other term-based program using credit hours). However, to receive a disbursement of Title IV aid for each subsequent subscription period in the program, the student must have completed a cumulative number of credit hours equal to the total of the number of hours for which the student was enrolled in all previously attended subscription periods in the program, excluding the number of hours for which the student was enrolled in the most recently attended subscription period. For more detailed guidance on the disbursement rules for subscription-based programs, including examples, refer to Appendix B at the end of this chapter. Multiple Disbursements Within a Payment Period The regulations governing the Title IV programs generally permit schools to pay Title IV funds at such times and in such installments within each payment period as will best meet students9 needs. This gives schools the ability to apportion the payment if doing so will be in the best interest of the student. For example, if a payment period is particularly long, a school might choose to pay in multiple installments to the extent program requirements permit to ensure that a student will have funds to pay rent later in the payment period. If a school chooses to schedule multiple Direct Loan disbursements within a single payment period, the disbursements must be substantially equal. Note also that if the loan period for a Direct Loan is a single payment period, the loan must be disbursed in at least two installments unless the school qualifies for an exception to the multiple disbursement requirement. See Volume 8, Chapter 3 for more']","For clock-hour or non-term credit-hour programs, disbursements are aligned with a non-term academic calendar. Payments are made when students complete half of the credit hours and instructional weeks for the academic year. The first disbursement occurs when students meet these criteria for the first half of the year, and subsequent disbursements follow the same criteria for the next half-year period.

In contrast, for subscription-based programs, the disbursement timing is not specifically detailed on StudentAid.gov. Typically, federal loan servicers update loan information weekly, and loan details usually appear in 7-10 business days after transfer. There are no explicit requirements mentioned regarding student milestones before receiving subsequent disbursements in subscription-based programs.

Would you like more detailed information on either program type?","In clock-hour or non-term credit-hour programs, students must complete both the required credit or clock hours and the weeks of instructional time in a payment period before receiving a disbursement of Pell Grant, FSEOG, TEACH Grant, or Direct Loan funds for the next payment period. The scheduled payment periods are established at the beginning of the program and do not change based on a student's rate of progression. In contrast, for subscription-based programs, there is no requirement for students to complete a certain amount of coursework before receiving disbursements for the first two subscription periods. However, for each subsequent subscription period, students must have completed a cumulative number of credit hours equal to the total number of hours for which they were enrolled in all previously attended subscription periods, excluding the most recently attended period, before receiving additional Title IV aid disbursements.",multi_hop_abstract_query_synthesizer,['StudentAid_Federal_Search'],15
"How does the disbursement timing for federal student aid differ between standard clock-hour or non-term credit-hour programs and subscription-based programs, particularly regarding the requirements a student must meet before receiving subsequent disbursements?","['StudentAid.gov Search Results for: disbursement timing federal student aid', ""Summary: Federal student aid disbursement timing varies by loan type and school. Direct loans are typically disbursed in two payments. Contact your school's financial aid office for specific details."", 'Official Federal Information:\n1. How do I check the status of my FAFSA® form?\n   Note: If you submitted a paper FAFSA form, you can check the status of your form once we process it (roughly 7–10 days from the date mailed).', 'To check the disbursement status of your federal student ...\n   URL: https://studentaid.gov/help/check-fafsa-status', '2. Student Loan Repayment\n   Published Time: Fri, 21 Mar 2025 10:13:02 GMT', 'StudentAid.gov Search Results for: disbursement timing for standard clock-hour or non-term credit-hour programs', ""Summary: For non-term or clock-hour programs, disbursements follow the academic term or the student's progress in clock hours. Pell Grants and other aid are disbursed in the academic term for non-standard terms. For clock-hour programs, disbursements occur at half the program's length and at completion."", 'Official Federal Information:\n1. Final Program\n   prorate Direct Subsidized/Unsubsidized Loan limits under certain circumstances is different than the requirements for calculating Pell Grants. All clock-hour programs, non-term credit-hour programs, a...\n   URL: https://studentaid.gov/sites/default/files/fsawg/datacenter/library/FPRD/Saint-Josephs-College-ME00205109032020FPRDRedacted.pdf', ""2. Fed era I Student !~iid\n   pre>grains; however, based on the published information and pllblisbed policies, and during interviewswit)l the school's staff, the pre>gram structure varies from nonstandard to non-term programs. -Th...\n   URL: https://studentaid.gov/sites/default/files/fsawg/datacenter/library/FPRD/Five_Branches_University_031313_11302018_FPRD_Redacted.pdf"", '3. Final Program Review Determination\n   program without terms or a clock hour program, the student has completed the payment period for which he or she has been paid a Pell Grant. 34 C.F.R. § 690.75(a)(l)-(3). For an eligible program that m...\n   URL: https://studentaid.gov/sites/default/files/fsawg/datacenter/library/FPRD/Central_Nursing_College_CA_041500_03_29_2018_FPRD_Redacted.pdf', 'StudentAid.gov Search Results for: disbursement timing for subscription-based programs', 'Summary: Disbursement timing for subscription-based programs via StudentAid.gov is not specified. Federal loan servicers update StudentAid.gov weekly. Loan information typically appears in 7-10 business days post-transfer.', 'Official Federal Information:\n1. ANNUAL REPORT FY 2020\n   The Next Gen FSA initiative delivered intuitive, self-service tools for students, parents, and borrowers. The new StudentAid.gov—FSA’s primary website for customers—consolidated the four most-visited ...\n   URL: https://studentaid.gov/sites/default/files/fy2020-fsa-annual-report.pdf', ""2. So Your Loan Was Transferred—What's Next?\n   Image 2\nHow long will it take for my new servicer’s info to show up on StudentAid.gov?\n----------------------------------------------------------------------------------"", 'Our federal loan servicers re...\n   URL: https://studentaid.gov/articles/your-loan-was-transferred-whats-next/']","['<1-hop>\n\nboth the credit or clock hours and the weeks of instructional time in a payment period before receiving a disbursement of Pell Grant, FSEOG, TEACH Grant or Direct Loan funds for the next payment period. For the Direct Loan Program only, this same requirement applies to students who are enrolled in programs with nonstandard terms that are not substantially equal in length. Effect of Accelerated Progression on Disbursement Timing in a Clock-Hour or Non-Term Credit-Hour Program The Pell Grant or TEACH Grant amount that a student is eligible to receive for a payment period in a clock-hour or non- term credit-hour program is based on the number of hours and weeks in the scheduled payment periods for the program that are established at the beginning of the program based on the program length (as described earlier in this chapter). These scheduled payment periods do not change, regardless of a student9s rate of progression through a clock-hour or non-term credit-hour program. This means that if a student completes additional weeks of instructional time or hours while completing the other measure of a payment period, the actual number of weeks or hours that the student completes before a disbursement can be made for the next payment period may differ from the number of weeks or hours in the scheduled payment period used to determine the student9s grant amount for the payment period. Although a student9s completion of additional weeks or hours in a payment period has no effect on the scheduled payment periods for purposes of determining Pell Grant and TEACH Grant payment amounts, an undergraduate student who accelerates in a clock-hour or non-term credit-hour program may have reduced Direct Loan eligibility in the final academic year of a program. Specifically, if a student enrolled in a program that is greater than one academic year in length completes additional clock or credit hours prior to the final academic year of the program, this may result in a final period of study that contains fewer clock or credit hours than the number of hours in the program9s defined academic year. In this circumstance, the Direct Loan annual loan limit for an undergraduate student must be prorated (reduced). The principles described above are illustrated by the examples in Appendix A at the end of this chapter. For guidance on calculating Pell Grant and TEACH Grant awards for clock-hour and non-term credit-hour programs, see Volume 7. For information on Direct Loan annual loan limit proration and annual loan limit progression in clock-hour and non-term credit- hour programs, see Volume 8, Chapters 5 and 6. If your school is unable to determine when a student has successfully completed half of the credit or clock hours in a program, academic year, or remainder of a program, the student is considered to have begun the second payment period of the program, academic year, or remainder of a program at the later of the date (identified by your school) that the student has successfully completed: half of the academic coursework in the program, academic year, or remainder of the program; or half of the number of weeks of instructional time in the program, academic year, or remainder of the program.', '<2-hop>\n\nDisbursement Timing in Subscription-Based Programs For the first two subscription periods (terms) that a student attends in a subscription-based program, there is no requirement for the student to have completed a certain amount of coursework before receiving a disbursement of Title IV funds (the same as in any other term-based program using credit hours). However, to receive a disbursement of Title IV aid for each subsequent subscription period in the program, the student must have completed a cumulative number of credit hours equal to the total of the number of hours for which the student was enrolled in all previously attended subscription periods in the program, excluding the number of hours for which the student was enrolled in the most recently attended subscription period. For more detailed guidance on the disbursement rules for subscription-based programs, including examples, refer to Appendix B at the end of this chapter. Multiple Disbursements Within a Payment Period The regulations governing the Title IV programs generally permit schools to pay Title IV funds at such times and in such installments within each payment period as will best meet students9 needs. This gives schools the ability to apportion the payment if doing so will be in the best interest of the student. For example, if a payment period is particularly long, a school might choose to pay in multiple installments to the extent program requirements permit to ensure that a student will have funds to pay rent later in the payment period. If a school chooses to schedule multiple Direct Loan disbursements within a single payment period, the disbursements must be substantially equal. Note also that if the loan period for a Direct Loan is a single payment period, the loan must be disbursed in at least two installments unless the school qualifies for an exception to the multiple disbursement requirement. See Volume 8, Chapter 3 for more']","For standard clock-hour or non-term credit-hour programs, disbursements generally follow the academic term or the student's progress in clock hours. Specifically, disbursements are made at the start of each academic term for non-standard terms, or at the halfway point and upon completion of the program for clock-hour programs. The student must typically meet the program's progress requirements and be enrolled at the time of disbursement.

In contrast, for subscription-based programs, the disbursement timing is not explicitly specified on StudentAid.gov. The process involves updates from federal loan servicers, which usually occur weekly. Loan information typically appears in the student's account within 7-10 business days after the transfer or update.

Additionally, for subscription-based programs, students must generally meet the standard eligibility requirements, and subsequent disbursements depend on the loan servicer's update cycle rather than specific program progress milestones.","In standard clock-hour or non-term credit-hour programs, students must complete both the required credit or clock hours and the weeks of instructional time in a payment period before they can receive a disbursement of Pell Grant, FSEOG, TEACH Grant, or Direct Loan funds for the next payment period. The scheduled payment periods are established at the beginning of the program and do not change based on a student's rate of progression. In contrast, for subscription-based programs, there is no requirement for a student to complete a certain amount of coursework before receiving a disbursement of Title IV funds for the first two subscription periods. However, for each subsequent subscription period, the student must have completed a cumulative number of credit hours equal to the total number of hours for which they were enrolled in all previously attended subscription periods, excluding the most recently attended period, before receiving additional disbursements.",multi_hop_abstract_query_synthesizer,['StudentAid_Federal_Search'],15
