user_input,retrieved_contexts,reference_contexts,response,reference,synthesizer_name
"If a practicum or clinical experience is required for licensure in a medical or education program, under what conditions can it be included in a standard term, and how does this differ from the characteristics that define non-term programs?","['Inclusion of Clinical Work in a Standard Term\\nPeriods of medical and education program clinical work which is conducted outside the classroom may not be included in\\na standard term, unless all of the following apply:\\nAll students in the program must participate in the practicum or clinical experience, and they must be required to\\ncomplete the practicum or clinical experience as a condition for applying for licensure or authorization to practice the\\noccupation they intend to pursue;\\nThe school has little or no control over the length or starting and ending dates of the practicum or clinical\\nexperience. This may be due to constraints imposed by outside licensing bodies or the need to accommodate\\nschedules of entities with which students are being placed (e.g., school districts or hospitals); and\\nCredit hours associated with the practicum or clinical experience must be associated with the term in which most of\\nthe training occurs, even if the starting and ending dates do not exactly align with the term dates and/or overlap with\\nanother term.\\nIf the clinical work meets all the above criteria, terms which include such clinical work are not required to be considered\\nnonstandard, nor are such programs required to be considered non-term, even if the clinical work overlaps another term.\\nThis flexibility is limited to required clinical periods associated with standard term programs in medicine (including, but\\nnot limited to, allopathic, osteopathic, nursing, veterinary, dentistry, pharmacy, and physical therapy), and student\\nteaching required to obtain a state teaching certificate.\\nSee Volume 8, Chapter 3 for additional guidance on certain exceptions to the normal loan period and disbursement timing\\nrules for Direct Loans when clinical work that meets the criteria described above is included in a standard term.\\nNonstandard Terms\\nGenerally, nonstandard terms are terms that are not semesters, trimesters, or quarters. For example, a 5-week term or a\\n23-week term would be considered a nonstandard term because no standard term can be fewer than nine weeks or\\ngreater than 21 weeks in length. Like standard terms, nonstandard terms may be equal in length or may be of different\\nlengths. If a program is offered in a combination of standard terms and nonstandard terms, the program is considered to\\nbe offered in nonstandard terms. Also, like standard terms, nonstandard terms may not overlap within a program.\\nEven if a school calls its terms semesters, trimesters, or quarters, they are considered to be nonstandard terms if they do\\nnot comply with the policy on standard term length, as described earlier. For instance, a 22-week semester or an 8-week\\nquarter must be treated as a nonstandard term, because a semester cannot contain more than 21 weeks and a quarter\\nmust include a minimum of nine weeks.\\nSemesters, trimesters, or quarters are also considered to be nonstandard terms if academic progress is not measured in\\nthe manner normally associated with the type of term. For example, if a program is offered in 15-week semesters but\\nmeasures academic progress in quarter credit hours, the semesters would be considered nonstandard terms.\\nNon-Term Characteristics\\nA program that measures progress in clock hours is always treated as a non-term program.\\nExcept for subscription-based programs, a program that measures progress in credit-hours is considered to have a non-\\nterm calendar if it has:\\nCourses that do not begin and end within a set period of time such as a term;\\nCourses that overlap terms;\\nSelf-paced and independent study courses that overlap terms; or\\nSequential courses that do not begin and end within a term.\\nPayment Periods\\nThe payment period is applicable to all Title IV programs except the Federal Work-Study (FWS) Program. For example,\\nTitle IV program disbursements (except FWS payments) must be made on a payment period basis, as discussed in detail', 'may not notify the school or the loan servicer right away, particularly if the parent borrower had requested a deferment of\\npayments while the student was enrolled at least half time.\\nIf a school is required to return Direct PLUS Loan funds that were disbursed after the date of the parent borrower9s death,\\nthe school should determine whether there is a surviving parent who can take out a Direct PLUS Loan for the amount of\\nthe original Direct PLUS loan that must be returned. If this is not an option, the school may award additional Direct\\nUnsubsidized Loan funds (up to the amounts normally available only to independent undergraduates) to the dependent\\nstudent (see <Annual Loan Limits for Independent Undergraduates and Certain Dependent Undergraduates= in Chapter 4\\nof this volume). In this specific circumstance, a school may originate a Direct PLUS Loan for a surviving parent or originate\\na Direct Unsubsidized Loan for the dependent student even if the loan period has ended.\\nFor additional guidance on other actions that a school must take when a Title IV aid recipient dies, see Appendix B of the\\nFSA Handbook.\\nExceptions to the Normal Loan Period and Disbursement Requirements When Clinical Work is Included in a Standard Term\\nVolume 3, Chapter 1 of the FSA Handbook describes standard terms (semesters, quarters, and trimesters) and\\nnonstandard terms, and explains that standard terms or nonstandard terms that are substantially equal and at least nine\\nweeks in length (<SE9W= nonstandard terms) may not include periods of clinical work, such as medical and education\\nprogram work which is conducted outside the classroom, unless certain requirements are met (see <Inclusion of Clinical\\nWork in a Standard Term=). If a standard term or SE9W nonstandard term contains clinical work that meets all the criteria\\nto be included in the term, this may result in certain exceptions to the normal loan period and disbursement rules as\\ndiscussed earlier in this chapter. We discuss these exceptions below.\\nIf clinical work meets the criteria described in Volume 3 to be included in a standard term or SE9W nonstandard\\nterm, the school must associate the clinical work with the term during which the majority of the clinical work occurs.\\nIf a student receives a Direct Loan for a term that includes clinical work and the clinical work begins before the\\nstarting date of the term with which the clinical work is associated, the loan period start date is the beginning date of\\nthe clinical work (rather than the starting date of the term, as would normally be the case).\\nFor example, if a school originates a Direct Loan for a Scheduled Academic Year (SAY) consisting of fall and spring\\nsemesters that run from September 1 through May 31, and the fall semester includes clinical work that begins on\\nAugust 15, the school would report the loan period dates as August 15 through May 31. If the clinical work does not\\nbegin until on or after the starting date of the term with which it is associated, the loan period start date would be\\nthe beginning date of the term.\\nIf the clinical work ends after the ending date of the term with which it is associated, the loan period end date for a\\nDirect Loan is the ending date of the clinical work (instead of the ending date of the term, as would normally be the\\ncase).\\nFor example, if a school originates a Direct Loan for a Scheduled Academic Year (SAY) consisting of fall and spring\\nsemesters that run from September 1 through December 31 (fall) and January 1 through May 31 (spring), and the\\nspring semester includes clinical work that ends on June 20, the school would report the loan period dates as\\nSeptember 1 through June 20. However, if the clinical work ends on or before the ending date of the term with which\\nit is associated, the loan period end date would be the ending date of the term.\\nIf loan period dates are adjusted as explained above to account for clinical work that begins before or ends after the\\nnormal term starting and ending dates, the academic year period to which the Direct Loan annual loan limit applies,\\nand the payment period dates must also be adjusted accordingly. Using the example above where the spring term of\\na fall-spring SAY contains clinical work that ends on June 20, and assuming that the annual loan limit applies to that\\nfall-spring SAY period, the school would report the academic year dates associated with the loan as September 1\\nthrough June 20, and would report the dates of the second payment period (the spring semester) as January 1\\nthrough June 20 (see Volume 3, Chapter 1 for guidance on payment periods, and Chapter 6 of this volume for\\ninformation on SAYs and monitoring annual loan limits).\\nIf there are two consecutive loan periods for standard terms or SE9W nonstandard terms that include clinical work,\\nand the first loan period has not ended when the clinical work associated with the next loan period is scheduled to\\nbegin (because the clinical work associated with the term has not yet been completed), it is permissible for the two\\nloan periods (and the associated payment periods) to overlap.']","['<1-hop>\n\nInclusion of Clinical Work in a Standard Term Periods of medical and education program clinical work which is conducted outside the classroom may not be included in a standard term, unless all of the following apply: All students in the program must participate in the practicum or clinical experience, and they must be required to complete the practicum or clinical experience as a condition for applying for licensure or authorization to practice the occupation they intend to pursue; The school has little or no control over the length or starting and ending dates of the practicum or clinical experience. This may be due to constraints imposed by outside licensing bodies or the need to accommodate schedules of entities with which students are being placed (e.g., school districts or hospitals); and Credit hours associated with the practicum or clinical experience must be associated with the term in which most of the training occurs, even if the starting and ending dates do not exactly align with the term dates and/or overlap with another term. If the clinical work meets all the above criteria, terms which include such clinical work are not required to be considered nonstandard, nor are such programs required to be considered non-term, even if the clinical work overlaps another term. This flexibility is limited to required clinical periods associated with standard term programs in medicine (including, but not limited to, allopathic, osteopathic, nursing, veterinary, dentistry, pharmacy, and physical therapy), and student teaching required to obtain a state teaching certificate. See Volume 8, Chapter 3 for additional guidance on certain exceptions to the normal loan period and disbursement timing rules for Direct Loans when clinical work that meets the criteria described above is included in a standard term. Nonstandard Terms Generally, nonstandard terms are terms that are not semesters, trimesters, or quarters. For example, a 5-week term or a 23-week term would be considered a nonstandard term because no standard term can be fewer than nine weeks or greater than 21 weeks in length. Like standard terms, nonstandard terms may be equal in length or may be of different lengths. If a program is offered in a combination of standard terms and nonstandard terms, the program is considered to be offered in nonstandard terms. Also, like standard terms, nonstandard terms may not overlap within a program. Even if a school calls its terms semesters, trimesters, or quarters, they are considered to be nonstandard terms if they do not comply with the policy on standard term length, as described earlier. For instance, a 22-week semester or an 8-week quarter must be treated as a nonstandard term, because a semester cannot contain more than 21 weeks and a quarter must include a minimum of nine weeks. Semesters, trimesters, or quarters are also considered to be nonstandard terms if academic progress is not measured in the manner normally associated with the type of term. For example, if a program is offered in 15-week semesters but measures academic progress in quarter credit hours, the semesters would be considered nonstandard terms.', '<2-hop>\n\nNon-Term Characteristics A program that measures progress in clock hours is always treated as a non-term program. Except for subscription-based programs, a program that measures progress in credit-hours is considered to have a non- term calendar if it has: Courses that do not begin and end within a set period of time such as a term; Courses that overlap terms; Self-paced and independent study courses that overlap terms; or Sequential courses that do not begin and end within a term. Payment Periods The payment period is applicable to all Title IV programs except the Federal Work-Study (FWS) Program. For example, Title IV program disbursements (except FWS payments) must be made on a payment period basis, as discussed in detail']","Clinical or practicum experiences required for licensure in medical or education programs can be included in a standard term under specific conditions:

1. All students in the program must participate in the practicum or clinical experience, and it must be a required condition for applying for licensure or authorization to practice.
2. The school has little or no control over the length or start and end dates of the practicum or clinical experience, often due to external licensing bodies or scheduling constraints with placement entities such as hospitals or school districts.
3. The credit hours associated with the practicum or clinical experience must be linked to the term during which most of the training occurs, even if the actual start and end dates do not exactly align with the term dates or overlap with another term.

This inclusion allows the clinical work to be part of a standard term without the program being classified as non-term or nonstandard, even if the clinical work overlaps with another term.

Differences from non-term programs include:

- Non-term programs are characterized by measuring progress in clock hours rather than standard academic units.
- They often have courses that do not begin and end within a set period, overlap multiple terms, or are self-paced or independent study courses.
- They do not conform to the typical length and structure of semesters, trimesters, or quarters (e.g., a 5-week or 23-week term).
- They are offered in a manner that does not align with normal academic progress measurement.

In summary, clinical or practicum experiences can be included in a standard term if they meet the specified criteria, primarily involving participation requirements, scheduling constraints, and linkage to the training period, which distinguishes them from non-term programs that do not follow standard academic scheduling or progress measurement methods.","A practicum or clinical experience required for licensure in a medical or education program can be included in a standard term if all students must participate in it as a condition for licensure, the school has little or no control over its length or dates (often due to external licensing bodies or placement schedules), and the credit hours are associated with the term in which most training occurs, even if the dates do not align exactly with the term or overlap another term. If these criteria are met, the program is not required to be considered non-term, even if the clinical work overlaps another term. In contrast, non-term programs are defined by characteristics such as measuring progress in clock hours, having courses that do not begin and end within a set term, courses that overlap terms, or self-paced and independent study courses. Thus, while required clinical experiences can be included in standard terms under specific conditions, programs with the non-term characteristics described must be treated as non-term programs.",multi_hop_abstract_query_synthesizer
