user_input,retrieved_contexts,reference_contexts,response,reference,synthesizer_name,tools_used,num_contexts
"how do disbursement timing rules for federal student aid differ between clock-hour or non-term credit-hour programs and subscription-based programs, especially regarding when students become eligible for their next disbursement?","['StudentAid.gov Search Results for: disbursement timing rules federal student aid clock-hour non-term credit-hour programs subscription-based programs', 'Summary: Disbursement timing for federal student aid follows BBAY for non-term credit-hour programs. Clock-hour programs must use a BBAY with at least 30 weeks of instruction. Federal Pell Grants use Pell Grant Formula 4 for non-term programs.', 'Official Federal Information:\n1. Final Program\n   prorate Direct Subsidized/Unsubsidized Loan limits under certain circumstances is different than the requirements for calculating Pell Grants. All clock-hour programs, non-term credit-hour programs, a...\n   URL: https://studentaid.gov/sites/default/files/fsawg/datacenter/library/FPRD/Saint-Josephs-College-ME00205109032020FPRDRedacted.pdf', '2. Student Loan Industry Glossary - Mohela\n   Claim: The process by which the lender (or lender’s servicer) requests reimbursement from the guarantor for its losses on a Stafford, SLS, PLUS,\nor Consolidation loan due to the borrower’s default or ...\n   URL: https://mohela.studentaid.gov/DL/resourceCenter/glossary.aspx', '3. ANNUAL REPORT FY 2020\n   The Next Gen FSA initiative delivered intuitive, self-service tools for students, parents, and borrowers. The new StudentAid.gov—FSA’s primary website for customers—consolidated the four most-visited ...\n   URL: https://studentaid.gov/sites/default/files/fy2020-fsa-annual-report.pdf']","['<1-hop>\n\nboth the credit or clock hours and the weeks of instructional time in a payment period before receiving a disbursement of Pell Grant, FSEOG, TEACH Grant or Direct Loan funds for the next payment period. For the Direct Loan Program only, this same requirement applies to students who are enrolled in programs with nonstandard terms that are not substantially equal in length. Effect of Accelerated Progression on Disbursement Timing in a Clock-Hour or Non-Term Credit-Hour Program The Pell Grant or TEACH Grant amount that a student is eligible to receive for a payment period in a clock-hour or non- term credit-hour program is based on the number of hours and weeks in the scheduled payment periods for the program that are established at the beginning of the program based on the program length (as described earlier in this chapter). These scheduled payment periods do not change, regardless of a student9s rate of progression through a clock-hour or non-term credit-hour program. This means that if a student completes additional weeks of instructional time or hours while completing the other measure of a payment period, the actual number of weeks or hours that the student completes before a disbursement can be made for the next payment period may differ from the number of weeks or hours in the scheduled payment period used to determine the student9s grant amount for the payment period. Although a student9s completion of additional weeks or hours in a payment period has no effect on the scheduled payment periods for purposes of determining Pell Grant and TEACH Grant payment amounts, an undergraduate student who accelerates in a clock-hour or non-term credit-hour program may have reduced Direct Loan eligibility in the final academic year of a program. Specifically, if a student enrolled in a program that is greater than one academic year in length completes additional clock or credit hours prior to the final academic year of the program, this may result in a final period of study that contains fewer clock or credit hours than the number of hours in the program9s defined academic year. In this circumstance, the Direct Loan annual loan limit for an undergraduate student must be prorated (reduced). The principles described above are illustrated by the examples in Appendix A at the end of this chapter. For guidance on calculating Pell Grant and TEACH Grant awards for clock-hour and non-term credit-hour programs, see Volume 7. For information on Direct Loan annual loan limit proration and annual loan limit progression in clock-hour and non-term credit- hour programs, see Volume 8, Chapters 5 and 6. If your school is unable to determine when a student has successfully completed half of the credit or clock hours in a program, academic year, or remainder of a program, the student is considered to have begun the second payment period of the program, academic year, or remainder of a program at the later of the date (identified by your school) that the student has successfully completed: half of the academic coursework in the program, academic year, or remainder of the program; or half of the number of weeks of instructional time in the program, academic year, or remainder of the program.', '<2-hop>\n\nDisbursement Timing in Subscription-Based Programs For the first two subscription periods (terms) that a student attends in a subscription-based program, there is no requirement for the student to have completed a certain amount of coursework before receiving a disbursement of Title IV funds (the same as in any other term-based program using credit hours). However, to receive a disbursement of Title IV aid for each subsequent subscription period in the program, the student must have completed a cumulative number of credit hours equal to the total of the number of hours for which the student was enrolled in all previously attended subscription periods in the program, excluding the number of hours for which the student was enrolled in the most recently attended subscription period. For more detailed guidance on the disbursement rules for subscription-based programs, including examples, refer to Appendix B at the end of this chapter. Multiple Disbursements Within a Payment Period The regulations governing the Title IV programs generally permit schools to pay Title IV funds at such times and in such installments within each payment period as will best meet students9 needs. This gives schools the ability to apportion the payment if doing so will be in the best interest of the student. For example, if a payment period is particularly long, a school might choose to pay in multiple installments to the extent program requirements permit to ensure that a student will have funds to pay rent later in the payment period. If a school chooses to schedule multiple Direct Loan disbursements within a single payment period, the disbursements must be substantially equal. Note also that if the loan period for a Direct Loan is a single payment period, the loan must be disbursed in at least two installments unless the school qualifies for an exception to the multiple disbursement requirement. See Volume 8, Chapter 3 for more']","The disbursement timing rules for federal student aid differ between clock-hour or non-term credit-hour programs and subscription-based programs primarily in how eligibility for subsequent disbursements is determined. 

For clock-hour and non-term credit-hour programs, federal regulations typically require that disbursements be aligned with the academic calendar, often based on a ""Beginning of the Academic Year"" (BBAY) concept. Specifically, clock-hour programs must use a BBAY with at least 30 weeks of instruction to determine disbursement timing. This means students become eligible for subsequent disbursements based on their progress within this academic calendar framework.

In contrast, subscription-based programs, which do not follow a traditional academic calendar, may have different disbursement timing rules. These programs often do not rely on a BBAY or fixed academic calendar but instead may disburse funds based on other criteria such as completed coursework, milestones, or a different schedule set by the institution or program.

In summary:
- **Clock-hour / Non-term credit-hour programs:** Disbursements are tied to a BBAY with at least 30 weeks of instruction, and students become eligible for subsequent disbursements based on this schedule.
- **Subscription-based programs:** Disbursements are not necessarily tied to a traditional academic calendar and may depend on other program-specific criteria.

Would you like more detailed information or specific regulations?","In clock-hour or non-term credit-hour programs, students must complete both the required credit or clock hours and the weeks of instructional time in a payment period before they can receive a disbursement of Pell Grant, FSEOG, TEACH Grant, or Direct Loan funds for the next payment period. The scheduled payment periods are set at the beginning of the program and do not change based on a student's rate of progression. In contrast, for subscription-based programs, there is no requirement for students to complete a certain amount of coursework before receiving disbursements for the first two subscription periods. However, for each subsequent subscription period, students must have completed a cumulative number of credit hours equal to the total hours enrolled in all previous subscription periods, excluding the most recent one, to be eligible for the next disbursement of Title IV aid.",multi_hop_abstract_query_synthesizer,['StudentAid_Federal_Search'],5
What are the differences in disbursement timing requirements for federal student aid between clock-hour or non-term credit-hour programs and subscription-based programs?,"['StudentAid.gov Search Results for: disbursement timing requirements federal student aid', ""Summary: Federal student aid disbursement timing depends on the type of loan and school schedule; contact your school's financial aid office for specific details."", 'Official Federal Information:\n1. How do I check the status of my FAFSA® form?\n   Note: If you submitted a paper FAFSA form, you can check the status of your form once we process it (roughly 7–10 days from the date mailed).', 'To check the disbursement status of your federal student ...\n   URL: https://studentaid.gov/help/check-fafsa-status', '2. Student Loan Repayment\n   Published Time: Fri, 21 Mar 2025 10:13:02 GMT', 'StudentAid.gov Search Results for: disbursement timing requirements for clock-hour or non-term credit-hour programs vs subscription-based programs', 'Summary: For non-term credit-hour programs, disbursement is based on completing half the credit hours and weeks of instruction. Clock-hour programs follow a similar disbursement schedule. Subscription-based programs have different disbursement rules.', 'Official Federal Information:\n1. Final Program\n   prorate Direct Subsidized/Unsubsidized Loan limits under certain circumstances is different than the requirements for calculating Pell Grants. All clock-hour programs, non-term credit-hour programs, a...\n   URL: https://studentaid.gov/sites/default/files/fsawg/datacenter/library/FPRD/Saint-Josephs-College-ME00205109032020FPRDRedacted.pdf', ""2. Fed era I Student !~iid\n   pre>grains; however, based on the published information and pllblisbed policies, and during interviewswit)l the school's staff, the pre>gram structure varies from nonstandard to non-term programs. -Th...\n   URL: https://studentaid.gov/sites/default/files/fsawg/datacenter/library/FPRD/Five_Branches_University_031313_11302018_FPRD_Redacted.pdf"", '3. Federal Student Aid What is the Loan Disbursement (Pay Out) Process?\n   How a loan is disbursed depends on the type of loan you receive and the type of school you attend (semester, term, or clock hour). You will receive written notification each time your loan is to be pa...\n   URL: https://studentaid.gov/help-center/answers/article/what-is-the-loan-disbursement-pay-out-process']","['<1-hop>\n\nboth the credit or clock hours and the weeks of instructional time in a payment period before receiving a disbursement of Pell Grant, FSEOG, TEACH Grant or Direct Loan funds for the next payment period. For the Direct Loan Program only, this same requirement applies to students who are enrolled in programs with nonstandard terms that are not substantially equal in length. Effect of Accelerated Progression on Disbursement Timing in a Clock-Hour or Non-Term Credit-Hour Program The Pell Grant or TEACH Grant amount that a student is eligible to receive for a payment period in a clock-hour or non- term credit-hour program is based on the number of hours and weeks in the scheduled payment periods for the program that are established at the beginning of the program based on the program length (as described earlier in this chapter). These scheduled payment periods do not change, regardless of a student9s rate of progression through a clock-hour or non-term credit-hour program. This means that if a student completes additional weeks of instructional time or hours while completing the other measure of a payment period, the actual number of weeks or hours that the student completes before a disbursement can be made for the next payment period may differ from the number of weeks or hours in the scheduled payment period used to determine the student9s grant amount for the payment period. Although a student9s completion of additional weeks or hours in a payment period has no effect on the scheduled payment periods for purposes of determining Pell Grant and TEACH Grant payment amounts, an undergraduate student who accelerates in a clock-hour or non-term credit-hour program may have reduced Direct Loan eligibility in the final academic year of a program. Specifically, if a student enrolled in a program that is greater than one academic year in length completes additional clock or credit hours prior to the final academic year of the program, this may result in a final period of study that contains fewer clock or credit hours than the number of hours in the program9s defined academic year. In this circumstance, the Direct Loan annual loan limit for an undergraduate student must be prorated (reduced). The principles described above are illustrated by the examples in Appendix A at the end of this chapter. For guidance on calculating Pell Grant and TEACH Grant awards for clock-hour and non-term credit-hour programs, see Volume 7. For information on Direct Loan annual loan limit proration and annual loan limit progression in clock-hour and non-term credit- hour programs, see Volume 8, Chapters 5 and 6. If your school is unable to determine when a student has successfully completed half of the credit or clock hours in a program, academic year, or remainder of a program, the student is considered to have begun the second payment period of the program, academic year, or remainder of a program at the later of the date (identified by your school) that the student has successfully completed: half of the academic coursework in the program, academic year, or remainder of the program; or half of the number of weeks of instructional time in the program, academic year, or remainder of the program.', '<2-hop>\n\nDisbursement Timing in Subscription-Based Programs For the first two subscription periods (terms) that a student attends in a subscription-based program, there is no requirement for the student to have completed a certain amount of coursework before receiving a disbursement of Title IV funds (the same as in any other term-based program using credit hours). However, to receive a disbursement of Title IV aid for each subsequent subscription period in the program, the student must have completed a cumulative number of credit hours equal to the total of the number of hours for which the student was enrolled in all previously attended subscription periods in the program, excluding the number of hours for which the student was enrolled in the most recently attended subscription period. For more detailed guidance on the disbursement rules for subscription-based programs, including examples, refer to Appendix B at the end of this chapter. Multiple Disbursements Within a Payment Period The regulations governing the Title IV programs generally permit schools to pay Title IV funds at such times and in such installments within each payment period as will best meet students9 needs. This gives schools the ability to apportion the payment if doing so will be in the best interest of the student. For example, if a payment period is particularly long, a school might choose to pay in multiple installments to the extent program requirements permit to ensure that a student will have funds to pay rent later in the payment period. If a school chooses to schedule multiple Direct Loan disbursements within a single payment period, the disbursements must be substantially equal. Note also that if the loan period for a Direct Loan is a single payment period, the loan must be disbursed in at least two installments unless the school qualifies for an exception to the multiple disbursement requirement. See Volume 8, Chapter 3 for more']","The disbursement timing requirements for federal student aid differ between clock-hour or non-term credit-hour programs and subscription-based programs. For clock-hour and non-term credit-hour programs, disbursement is typically based on the completion of specific instructional milestones, such as completing half of the credit hours and weeks of instruction. This means that disbursements are tied to the progress within the program.

In contrast, subscription-based programs have different disbursement rules that are not necessarily linked to specific instructional milestones. The exact timing and conditions for disbursement in subscription-based programs can vary and are subject to the specific policies of the school and the type of loan.

For detailed and specific information, it is recommended to contact the school's financial aid office or review the official federal guidelines provided in the linked documents.","In clock-hour or non-term credit-hour programs, students must complete both the required credit or clock hours and weeks of instructional time in a payment period before receiving a disbursement of Pell Grant, FSEOG, TEACH Grant, or Direct Loan funds for the next payment period. The scheduled payment periods are established at the beginning of the program and do not change based on a student's rate of progression. In contrast, for subscription-based programs, there is no requirement for students to complete a certain amount of coursework before receiving a disbursement of Title IV funds for the first two subscription periods. However, for each subsequent subscription period, the student must have completed a cumulative number of credit hours equal to the total of the hours enrolled in all previously attended subscription periods, excluding the most recent one, to receive further disbursements.",multi_hop_abstract_query_synthesizer,['StudentAid_Federal_Search'],10
