user_input,retrieved_contexts,reference_contexts,response,reference,synthesizer_name
"How does the structure of an academic calendar, such as standard term, nonstandard term, non-term, or subscription-based, affect the calculation and disbursement of Pell Grant awards?","['non-term (includes clock-hour calendars), or\\nsubscription-based.\\nIn a standard term or nonstandard term academic calendar, a term is generally a period in which all classes are\\nscheduled to begin and end within a set time frame, and academic progress is measured in credit hours.\\nIn a non-term academic calendar, classes do not begin and end within a set time frame, such as a term. Academic\\nprogress in a non-term program can be measured in either credit or clock hours. In some cases (as discussed below), a\\nprogram with terms must be treated as a non-term program for Title IV purposes.\\nA subscription-based academic calendar is used only by subscription-based programs. A subscription-based program\\nis a term-based program in which the school charges a student for each term on a subscription basis with the expectation\\nthat the student will complete a specified number of credit hours (or the equivalent) during that term. However, classes in\\na subscription-based program are not required to begin or end within a specific timeframe in each term, as is the case in a\\nterm-based calendar that is not subscription-based. For more detail on subscription-based programs, see Volume 2,\\nChapter 2.\\nA subscription-based academic calendar consists of ""subscription periods"" that are either standard terms or substantially\\nequal nonstandard terms (for guidance on when terms are considered to be substantially equal in length, see <Payment\\nperiods for programs using standard terms or substantially equal nonstandard terms= later in this chapter). Substantially\\nequal nonstandard terms may be of any length, but if they are not at least nine weeks in length, the program must use\\nBBAY 3 for purposes of monitoring Direct Loan annual loan limit progression (see Volume 8, Chapter 6 for more\\ninformation on BBAY 3). Nonstandard terms that are not substantially equal in length are not permissible in a\\nsubscription-based academic calendar.\\nThe term ""subscription period"" is synonymous with ""term"" and ""payment period"" (payment periods are covered later in\\nthis chapter). Except for the fact that classes are not required to start and end within a term, the rules and requirements\\nfor term-based programs that are not subscription-based also apply to subscription-based programs. These requirements\\ninclude:\\nminimum and maximum term length restrictions for standard terms (see the discussion in the next section of this\\nchapter);\\nrequirements for determining full-time enrollment (see Volume 1, Chapter 1);\\nuse of a Scheduled Academic Year (SAY), BBAY 1, BBAY 2, or BBAY 3 for monitoring Direct Loan annual loan limit\\nprogression (see Volume 8, Chapter 6); and\\nuse of Pell Grant formulas 1, 2, or 3 to calculate Pell Grant awards (see Volume 7, Chapter 4).\\nWhether an academic calendar is standard term, nonstandard term, non-term, or subscription-based has implications for\\nhow aid is awarded and disbursed under the Title IV programs.\\nStandard Terms: Semesters, Trimesters, and Quarters\\nSemesters and trimesters contain between 14 and 21 weeks of instructional time. However, a summer term in a program\\nusing semesters or trimesters may contain fewer than 14 weeks. An academic calendar that uses semesters or trimesters\\ntraditionally has three terms, one each in the fall, spring, and summer, two of which comprise an academic year. For\\nexample, in a program using an SAY calendar, fall and spring would comprise an academic year. In a program using a\\nSubscription-Based Program\\n34 CFR 668.2(b)', 'If the student9s calculated Pell Grant is less than the published Min Pell amount for the award year, the student is not\\neligible for a calculated Pell Grant. However, the student may still meet eligibility requirements for Min Pell based on AGI,\\nfamily size, state of residence, and poverty guidelines, described previously.\\nDetermining the Award Year for Crossover Pell Awards\\nYou must source Pell Grant funds from the award year to which the payment period is assigned. When awarding Pell\\nGrants for a crossover payment period, you may assign the payment period to the award year that best meets the needs\\nof your students and maximizes a student9s eligibility over the two award years in which the crossover payment period\\noccurs. For general information about payment periods, see Chapter 1 of Volume 3, and for more detail on crossover\\npayment periods, see the section on crossover payment periods in Chapter 5 of this volume.\\nBasic Pell Grant Formulas\\nExcept for subscription-based programs (see Volume 3, Chapter 1 for information on subscription-based programs), if all\\ncoursework is offered in credit hours and scheduled to be completed within a specific time frame, the program generally\\ncan be considered term-based. Term-based programs can have either standard terms or nonstandard terms. Pell Grants\\nare usually calculated differently for the two types of terms. Standard-term programs may be treated similarly to\\nnonstandard-term programs if the program does not conform to a traditional academic calendar or meet certain other\\nThe school performs the steps in the Calculated Pell Grant process to determine the student9s Scheduled Award.\\nStep 1: Max Pell ($7,500) - SAI (1,004) = $6,496\\nStep 2: Calculated Pell Grant ($6,496) > Min Pell ($750)\\nStep 3: Round Calculated Pell Grant ($6,496) to the nearest $5 = $6,495\\nStep 4: Rounded Calculated Pell Grant ($6,495) > Pell Grant COA ($6,493)\\nSince the calculated Scheduled Award is greater than the Pell COA, the school determines the student9s\\nScheduled Award must be capped at the COA. The student is eligible for a Scheduled Award of $6,493.\\nVolume 7, Chapter 2, Example 3: Ineligible for Calculated Pell Grant\\nA student9s calculated SAI is 6,751 and the Pell COA is $9,000. For demonstration purposes, assume the published\\nMax Pell for the award year is $7,500. The published Min Pell for the award year is 10% of the Max Pell, or $750.\\nThe school performs the steps in the Calculated Pell Grant process to determine the student9s Scheduled Award.\\nStep 1: Max Pell ($7,500) - SAI (6,751) = $749\\nStep 2: Calculated Pell Grant ($749) < Min Pell ($750)\\nSince this student9s Calculated Pell Grant is less than the published Min Pell for the award year, the student is not\\neligible for a Calculated Pell Grant. However, the student may still meet eligibility requirements for a Min Pell.\\nCrossover payment periods\\n34 CFR 690.64 3 Determining the award year for a Pell Grant crossover payment period', 'Credit or Clock Hours in an Academic Year\\nFor undergraduate educational programs, the law and regulations set the following minimum standards for coursework\\nearned by a full-time student in an academic year:\\nFor a program measured in credit hours, 24 semester or trimester credit hours or 36 quarter credit hours; or\\nFor a program measured in clock hours, 900 clock hours.\\nFor graduate and professional programs, there is no minimum number of hours in an academic year.\\nAcademic Year Definition and Effect on Awards\\nThe Title IV academic year that a school defines for a program must meet the regulatory minimums for both clock or\\ncredit hours and weeks of instructional time, as described above. In some instances, the defined academic year for a\\nprogram may not coincide with the academic calendar of the school. For example, a school might define the academic\\nyear for a program as containing 24 semester hours and 30 weeks of instructional time but have an academic calendar\\nconsisting of four 8-week nonstandard terms (i.e., 32 weeks of instructional time). This would affect the calculation of Pell\\nGrant awards, as explained in Volume 7.\\nAs discussed later in this chapter and in Volume 8, Chapter 6, the timing of disbursements and, for the Direct Loan\\nProgram, annual loan limit progression will be affected if a program is an academic year in length in credit or clock hours\\nbut not in weeks of instructional time, or for a program longer than an academic year in length, if a student9s completion\\nof the credit or clock hours in the program9s academic year does not coincide with completion of the weeks of\\ninstructional time in the academic year.\\nAcademic Calendars and Terms\\nSchools offer programs with many kinds of academic calendars that differ from the traditional fall-spring school year. For\\nthe Title IV programs, academic calendars may be one of the following types:\\nstandard term,\\nnonstandard term,\\nThe calendar graphic below illustrates how a school would count weeks of instructional time in a standard\\nsemester term during which classes are held Monday through Friday. In this hypothetical term (the example is not\\nmeant to illustrate any specific calendar year) classes begin on Monday, August 23rd, and end on Friday,\\nDecember 10th, with examinations held December 13th-17th.\\nThe circles indicate the points at which each of the 17 weeks of instructional time begin.\\nThere are no classes on Labor Day (September 6th), Veterans Day (November 11th), or during Thanksgiving\\nbreak (November 24th-26th), but each week that includes these dates still counts as a week of instructional time\\nsince each includes at least one day of regularly scheduled instruction. The week of exams that begins on\\nDecember 13th also counts as a week of instructional time.\\nIf a week in the term has no days of instruction, examination, or (after the last day of classes) study for\\nexamination, that week does not count as a week of instructional time. For example, a week consisting only of\\nvacation days is not a week of instructional time.']","['non-term (includes clock-hour calendars), or subscription-based. In a standard term or nonstandard term academic calendar, a term is generally a period in which all classes are scheduled to begin and end within a set time frame, and academic progress is measured in credit hours. In a non-term academic calendar, classes do not begin and end within a set time frame, such as a term. Academic progress in a non-term program can be measured in either credit or clock hours. In some cases (as discussed below), a program with terms must be treated as a non-term program for Title IV purposes. A subscription-based academic calendar is used only by subscription-based programs. A subscription-based program is a term-based program in which the school charges a student for each term on a subscription basis with the expectation that the student will complete a specified number of credit hours (or the equivalent) during that term. However, classes in a subscription-based program are not required to begin or end within a specific timeframe in each term, as is the case in a term-based calendar that is not subscription-based. For more detail on subscription-based programs, see Volume 2, Chapter 2. A subscription-based academic calendar consists of ""subscription periods"" that are either standard terms or substantially equal nonstandard terms (for guidance on when terms are considered to be substantially equal in length, see <Payment periods for programs using standard terms or substantially equal nonstandard terms= later in this chapter). Substantially equal nonstandard terms may be of any length, but if they are not at least nine weeks in length, the program must use BBAY 3 for purposes of monitoring Direct Loan annual loan limit progression (see Volume 8, Chapter 6 for more information on BBAY 3). Nonstandard terms that are not substantially equal in length are not permissible in a subscription-based academic calendar. The term ""subscription period"" is synonymous with ""term"" and ""payment period"" (payment periods are covered later in this chapter). Except for the fact that classes are not required to start and end within a term, the rules and requirements for term-based programs that are not subscription-based also apply to subscription-based programs. These requirements include: minimum and maximum term length restrictions for standard terms (see the discussion in the next section of this chapter); requirements for determining full-time enrollment (see Volume 1, Chapter 1); use of a Scheduled Academic Year (SAY), BBAY 1, BBAY 2, or BBAY 3 for monitoring Direct Loan annual loan limit progression (see Volume 8, Chapter 6); and use of Pell Grant formulas 1, 2, or 3 to calculate Pell Grant awards (see Volume 7, Chapter 4). Whether an academic calendar is standard term, nonstandard term, non-term, or subscription-based has implications for how aid is awarded and disbursed under the Title IV programs. Standard Terms: Semesters, Trimesters, and Quarters Semesters and trimesters contain between 14 and 21 weeks of instructional time. However, a summer term in a program using semesters or trimesters may contain fewer than 14 weeks. An academic calendar that uses semesters or trimesters traditionally has three terms, one each in the fall, spring, and summer, two of which comprise an academic year. For example, in a program using an SAY calendar, fall and spring would comprise an academic year. In a program using a']","The structure of an academic calendar—such as standard term, nonstandard term, non-term, or subscription-based—significantly influences the calculation and disbursement of Pell Grant awards. Here's how:

1. Term Definition and Scheduling:
   - Standard and Nonstandard Terms: These are scheduled periods with defined start and end dates, typically measured in credit hours and weeks of instruction. Pell Grant formulas are applied based on these terms, with specific rules for calculating awards depending on whether the program uses standard or nonstandard terms.
   - Non-term Programs: Classes do not have fixed start and end dates, and progress may be measured in credit or clock hours without specific calendar dates. This can complicate Pell Grant calculations, which often rely on defined terms.
   - Subscription-based Programs: These are term-based but charge students on a subscription basis, with ""subscription periods"" that may be standard or nonstandard. Classes are not required to start or end within specific timeframes, affecting how payment periods are identified and how awards are calculated.

2. Impact on Pell Grant Formulas:
   - Term-based programs (standard or nonstandard) typically calculate Pell Grants based on the scheduled length of the term, enrollment status, and weeks of instruction.
   - Subscription-based programs have similar rules but with more flexibility in scheduling, which can influence disbursement timing and enrollment measurement.

3. Disbursement Timing:
   - Disbursements in standard and nonstandard term programs are often aligned with specific payment periods within each term.
   - In subscription-based programs, disbursements are based on subscription periods, which can vary in length, influencing when and how much aid is disbursed.

4. Monitoring and Eligibility:
   - The calendar structure affects how schools monitor full-time enrollment, determine the academic year, and track progress for Pell Grant eligibility.
   - Subscription periods, which may vary in length, impact how schools monitor student progress and disburse aid.

5. Special Considerations:
   - Non-term and subscription-based calendars may require treating certain programs as non-term for Title IV purposes, which can alter the Pell Grant calculation process.
   - The definition of an academic year, based on weeks of instruction and hours of coursework, interacts with the calendar structure to determine eligibility and award amounts.

In summary, the academic calendar structure determines how Pell Grant awards are calculated by defining relevant payment periods, enrollment status, and progress measurement. It also influences the timing and method of disbursement to ensure aid aligns with the student's actual academic engagement within the program's scheduling framework.","The structure of an academic calendar—whether it is standard term, nonstandard term, non-term, or subscription-based—affects how Pell Grant awards are calculated and disbursed. In subscription-based programs, which are term-based but do not require classes to start and end within a specific timeframe, the rules and requirements for term-based programs that are not subscription-based also apply. This includes the use of Pell Grant formulas 1, 2, or 3 to calculate Pell Grant awards. The type of academic calendar determines the applicable Pell Grant formula and the timing of aid disbursement under Title IV programs.",single_hop_specifc_query_synthesizer
"medicine program clinical work, it gotta be in standard term or not?",[],"['Inclusion of Clinical Work in a Standard Term Periods of medical and education program clinical work which is conducted outside the classroom may not be included in a standard term, unless all of the following apply: All students in the program must participate in the practicum or clinical experience, and they must be required to complete the practicum or clinical experience as a condition for applying for licensure or authorization to practice the occupation they intend to pursue; The school has little or no control over the length or starting and ending dates of the practicum or clinical experience. This may be due to constraints imposed by outside licensing bodies or the need to accommodate schedules of entities with which students are being placed (e.g., school districts or hospitals); and Credit hours associated with the practicum or clinical experience must be associated with the term in which most of the training occurs, even if the starting and ending dates do not exactly align with the term dates and/or overlap with another term. If the clinical work meets all the above criteria, terms which include such clinical work are not required to be considered nonstandard, nor are such programs required to be considered non-term, even if the clinical work overlaps another term. This flexibility is limited to required clinical periods associated with standard term programs in medicine (including, but not limited to, allopathic, osteopathic, nursing, veterinary, dentistry, pharmacy, and physical therapy), and student teaching required to obtain a state teaching certificate. See Volume 8, Chapter 3 for additional guidance on certain exceptions to the normal loan period and disbursement timing rules for Direct Loans when clinical work that meets the criteria described above is included in a standard term. Nonstandard Terms Generally, nonstandard terms are terms that are not semesters, trimesters, or quarters. For example, a 5-week term or a 23-week term would be considered a nonstandard term because no standard term can be fewer than nine weeks or greater than 21 weeks in length. Like standard terms, nonstandard terms may be equal in length or may be of different lengths. If a program is offered in a combination of standard terms and nonstandard terms, the program is considered to be offered in nonstandard terms. Also, like standard terms, nonstandard terms may not overlap within a program. Even if a school calls its terms semesters, trimesters, or quarters, they are considered to be nonstandard terms if they do not comply with the policy on standard term length, as described earlier. For instance, a 22-week semester or an 8-week quarter must be treated as a nonstandard term, because a semester cannot contain more than 21 weeks and a quarter must include a minimum of nine weeks. Semesters, trimesters, or quarters are also considered to be nonstandard terms if academic progress is not measured in the manner normally associated with the type of term. For example, if a program is offered in 15-week semesters but measures academic progress in quarter credit hours, the semesters would be considered nonstandard terms.']",Could you please clarify your question a bit more? Are you asking whether clinical work in a medicine program needs to be documented or described using standard medical terminology? Or are you referring to the requirements for clinical work in a specific medicine program? Providing more details will help me give you a more accurate answer.,"If the clinical work in a medicine program meets all the criteria listed—like all students must do it, it's required for licensure, the school don't control the dates, and the credit hours go with the term where most training happens—then terms with that clinical work don't gotta be considered nonstandard, even if the clinical work overlaps another term.",single_hop_specifc_query_synthesizer
